"@OfficialFJBCoin the hospitals lied to get the fed money for each case, then the MSM to make it appear worse, then… https://t.co/67XdNLUA9N"
@FoxNewsSunday @MeetThePress @FaceTheNation @CNNSotu Any of you all attempted to get @paraga on?  Might be a good c… https://t.co/VvrqrQKB0e
Anthony Fauci and the Creation of the Bio-Security State ... 👇👇 https://t.co/A3lHephaKQ  https://t.co/s7j4DiOOgs
"Speaking in an interview with CNN's Kate Bolduan, Dr. Anthony Fauci agreed it's only a matter of time before the de… https://t.co/s3YK20jzko"
@Hagstrom_Anders Even the reasonable democrats have turned from Biden &amp; Fauci
@Petor706 @nocontextcfb Still more humane than what Fauci did to beagles
"@walsh0313 @stoneboxdirk @WSMV Hey, Fauci said it first! 👍🏼"
Adolf BIDEN and Joseph FAUCI ARE today's HITLER and MENGELE!!! https://t.co/R7vLeYVL0M
This interview is one of his most infuriating.  Fauci has no respect for individual autonomy.   I say he's in it fo… https://t.co/azodXSoqIZ
@TheRealHEELJODY @LegendaryEnergy @JoeBiden I’m 90% sure that has trump been re-elected… Fauci would have been fired within the first month
"@TheRealHEELJODY @LegendaryEnergy @JoeBiden We don’t know what goes on in those rooms, but rumors have it that trum… https://t.co/xwFsRCR3JH"
@stoneboxdirk @WSMV Are you kidding? The purpose of the shot is supposed to be to lessen your sickness not prevent… https://t.co/9GKmFbrVWZ
Fauci on How This Ends #scienceVs  https://t.co/GhP1dhizUu via @PodcastAddict
@TwitterSupport Remember how you banned me for saying this a week ago? Moderna and Fauci are fighting over ownershi… https://t.co/D61IuEsZpA
@trgreatorex11 @LegendaryEnergy @JoeBiden Trump never fired Fauci . Now think about that.
@JayinWashington Fauci all so said if a person with AIDS touched a  door knob and you touched that door knob you wo… https://t.co/8KBn9EbPJ1
Fauci——you are not going to tell me what to do!!!!
"@TheTweetOfGod Fauci ,Say My name you know Who I am, To Hot!!!  aka Bruno mars"
@JasonZacharyTN It seems reasonable in order to keep compromised family members safe. You’ve gone against Fauci fro… https://t.co/lbGmbrLsgD
@Breaking911 Major W.  We need everyone to get their 3 doses so we can start to get back to normal.  Thank you Fauci and Biden
@ggreenwald   I’m a huge dog lover like you and say Dr.Fauci needs to go not only for supporting Gain of Function R… https://t.co/Rkbo7WI9fh
A Meeting of Fauci Anonymous https://t.co/HN9X9BRHx8
PEOPLE STILL LISTEN TO FAUCI? https://t.co/PuAI9KrPyH
POLL: Dr. Fauci says it's a different issue to require COVID tests for flights into the U.S. but not those crossing… https://t.co/CAvWrhgB8a
"If Fauci will lie under oath, imagine what the megalomaniac has done for clout. In the 80’s he said someone with AI… https://t.co/SgkDSplsjm"
"REDEFINING 'FULLY VACCINATED:'  Dr. Anthony Fauci agreed it's only a matter of time before the definition of ""fully… https://t.co/OSjzFTRqe8"
@Breaking911 Thank you Dr Fauci for being an American hero and thank you President Biden for Operation Warpspeed
"@RWMaloneMD old fart is realy like old fart, keep farting fauci maybe you die by your fart https://t.co/CSfdF5MWcm"
"""I don't see that changing tomorrow or next week, but certainly if you want to talk about optimal protection is...… https://t.co/2nxymR5Ler"
"Fauci Tells CNN It’s ‘A Matter Of When, Not If’ Definition Of ‘Fully Vaccinated’ Changes https://t.co/hZq1mcYoS3 https://t.co/0dTxzYL4Lz"
I still remember that ballgame Fauci...  Why is it that all the people up top who keep on telling us plebs down bel… https://t.co/Rz6QjlEaOB
Dr. Fauci believes the definition of 'fully vaccinated' will change to include boosters https://t.co/6HNY0IsRWx
"I want to mention that when guidance changes, it’s not because the scientists were all wrong - it’s because the vir… https://t.co/BNyRgPoVH6"
Fauci: Sometimes ‘We Have To Put Communal Responsibility Ahead Of Individual Preferences’ And Mandate Vaccines… https://t.co/Uu5hPla3zI
@townhallcom Dr. Freddy Fauci chirps again… https://t.co/f9VEdUksWV
@KwikWarren They want president Biden to fail at beating Covid so  science and Dr. Fauci are in the way also.
Commentary: Anthony Fauci and the Creation of the Bio-Security State https://t.co/1AWAkNrssH
It’s now a cold for most people and still at over 99% survival rate. Lil’Fauci needs to STFU https://t.co/F8frkILL9C
"Fauci wants his house guests to show him their papers. I didn't know the name ""Fauci"" had Germanic roots. https://t.co/mCDKpL1SEA"
"There are more people than ever seeking boosters as the Omicron variant spreads across the U.S. Right now, experts… https://t.co/Rr6V4pVeRj"
@DevoutDriller @tilford_hm these lunatics would die for fauci
"@tomselliott ""I doubt that the government will be the main mover of a vaccine passport concept."" - Anthony Fauci (""The Science""), April 2021"
Fauci's agency funded China's bat coronavirus research for years: Judicial Watch report https://t.co/w4H3a0l0bT via @JustTheNews
"If given the opportunity to sit down with Dr. Anthony Fauci, @Dougsbriefcase says, he would ask him “to apologize f… https://t.co/U2jvAC3uk7"
"Can we now say, with a certain degree of certainty, that Fauci and the CDC have created, with Gain Of Function reseach, Covid-19? #FauciLied"
@woods_kathy @RobertKennedyJr It’s all making sense now. Thank you Mr. Kennedy for speaking out!!! I really hope mo… https://t.co/xIlvxXz2T1
"If we are trying to figure out if the current vaccines will work, why are we recommending everyone get a booster fi… https://t.co/rLLmRH9Qwt"
I believe the opposite.  Exclusive—Mark Meadows: Firing Fauci Right Before Nov. 3rd Election Would Send Message We’… https://t.co/xAuY4JzEB9
I have been vaccinated and boosted. But you can see why people are leery of the narrative. We need Fauci to bow out… https://t.co/Fro2aVNRFP
Good morning. This is your daily reminder that Fauci tortured puppies and funded reckless gain of function research… https://t.co/p6VhARXbU6
"@jenneraub They don’t want normal. They are a nobody in normal, this goes all the way up to Fauci. With covid, they… https://t.co/SDdUKJllNt"
@plwin49 @ifihadastick @BrettKelman @CDCDirector The issue then is the ease with which he lied … rather than asking… https://t.co/zvB9yZQsvT
The MD in South Africa who discovered omicron said weeks ago that it spread fast but it wasn't as bad as the delta… https://t.co/GAjE7h1sD6
When @PatUnleashed did the scene from the meme George Bailey should have said “that’s right at a boy Fauci way to go”
"The default solution for big government types like Biden and Fauci is always more rules, more regulation and less o… https://t.co/0v4uIY2J27"
Robert F Kennedy's Bombshells Explode In Face Of Fauci &amp; CIA (Video) » Sons of Liberty Media https://t.co/RWIwfjVRnQ
Irony. Nugent has no problem slandering Dr Fauci and President Obama. https://t.co/eHp2dgoPcJ
Seriously?  https://t.co/iOZoObKczj
Birthing Person Withholds Christmas Gifts Until Son Gets Fauci Jab https://t.co/aZ8pbLeVfN via @YouTube
"@oliverdarcy That kills them, well that walking into the ovens are the gas Chambers,drFauci is killing people with… https://t.co/XPeiiwvLjU"
"@oliverdarcy My dad was a WWII veteran, she is exactly right he served in Germany and help empty the concentration… https://t.co/wQpVpMNxKW"
@DeaceProducer #BuySellHold Steve will invited on @billmaher show to talk about Fauci and Covidstan before he’s invited to speak at CPAC
Write this down - we are not far off from democrats turning on #Fauci and realizing that republicans were right this entire time.
Fauci is a Nazi. Read a history book about Hitler and his s.s. idiots and blood thirsty so called doctors 👿☠️👿💩🦍🤪😜😵… https://t.co/4xQZyOncZA
Fauci needs to be arrested he is a Nazi. Read your history books about mengel🤮🐷😵😜🤪🤬🦍💩😠 https://t.co/pi4XLj4ThX https://t.co/Pa3JPp05Zi
@rottenbanana101 @RobManess I tried to correct the @Wikapedia__ article but it states it is locked and I don’t have… https://t.co/mSC4u8pBhp
@mattyglesias RBG belongs to the group of people whose sudden rise in popularity was purely an artifact of anti-con… https://t.co/qJy0PH6wNU
"That should have been the strategy from the outset. That is, in fact, what the Pandemic Playbook said to do bf Dr F… https://t.co/rDibeV1ubt"
@BigOneNoOnions Not if it’s Dr. Fauci.
We encourage our volunteers to practice safe health and follow CDC guidelines. For a complete list of #volunteer op… https://t.co/OIevTURCJP
Dr. Fauci Says Omicron ‘Almost Certainly’ Less Severe Than Delta Variant https://t.co/jBNqFbK5lN via @dailycaller
@Smcapp @hawley5150 @JackPDog @julesmcgowan01 @olelady6 @trishsroses The esteemed Dr Fauci hasn't mentioned any of… https://t.co/2XpEtaNLMK
"@TurkReno @GovernorKayIvey so fauci, cdc, who, just to name a few willingly admit the shot does not prevent the spr… https://t.co/Tx5KMUC1rg"
The complete avoidance of natural immunity by the likes of Fauci and his comrades shows it’s not about science. It’… https://t.co/U0YLmkwVdn
"Dr. Fauci, What Happened to ""Do No Harm""? #MichaelDelGiorno #DrFauci #Oathbreaker #DavidZanotti https://t.co/sxHrluCKZ6"
@hawley5150 @SueWagnerWhite @Smcapp @JackPDog @julesmcgowan01 @olelady6 @trishsroses Apples/oranges?? I could list… https://t.co/D2P8mD0Ynk
"Omicron 'Almost Certainly' Not More Severe than Delta, Fauci Says #Health https://t.co/YXtnZTuVFf"
"@TowingMikes During the HIV ""pandemic"" DR(?) Fauci promised a vacine.  Ronnie and Nancy lived in WH."
"@1Pammsy And someone should dress better.  We need a commission to look into Fauci, Gates ... their role in GOF and… https://t.co/q3HAG3yrTT"
Dr. Fauci did not give us Covid it was given to us by the Chinese https://t.co/aKJ9aSrk8E
@pewpewonepew It sure sounded like it!! Fauci be praised!! Oh I mean Saint Fauci!!
Fox News Suspends Lara Logan After Dr. Fauci Complains She Criticized Him. She’s not wrong. https://t.co/WicLQnoxHv
The important thing to keep in mind when navigating the crazy crypto/NFT markets is that Fauci tortured puppies and… https://t.co/JCve8WUiu7
How Do You Overhype That?’: Fauci Objects To Ron Johnson Claim That He Wants To Keep People Scared Of COVID… https://t.co/MHmyEfQ1Mu
"Dr. Anthony Fauci, is the chief medical adviser to President Joe Biden I thought that was the job of the Surgeon General"
"Dr. ""I Am Science"" Fauci Has All The Answers On CONvid-1984 Containment Until It Involves Illegal Alien Invaders At… https://t.co/Ud0nvJWNRk"
Fauci's Dead Babies &amp; Mass Graves From The Past (Video) » Sons of Liberty Media https://t.co/u3VAEnredu
"Anthony Fauci, Bill Gates, Joe Biden, Xi Jinping, Boris Johnson, Angela Merkel, the World Health Organization, the… https://t.co/gifYzCpTsm"
@SarahDahlgren3 He looks like Fauci.
@BigOneNoOnions That is so gross! I kissed Dr. Fauci on the mouth weirdo.
Look what my son sent me!!! It’s Dr. Fauci!! I wanted one SO much!! I gave him a big kiss on the mouth. My daughter… https://t.co/Pg6OtKD2ku
"She's wants Fauci held accountable for animal cruelty,esp to Beagles ! https://t.co/fhJ4LfjTsz"
Fox News Sidelines Lara Logan After Fauci Complains About Her Nazi Doctor Comparison - https://t.co/uZ4wOoTcKs
Special Guest Senator Rand Paul On What He REALLY Thinks of Fauci! #shorts https://t.co/ENL2fIk3Vf via @YouTube
@ShootyMcBeard We can probe them &amp; get away with it since Fauci did
"Just read the Kennedy’s book “the real Anthony Fauci”.  With all the crap going on, the last thing  we need is to l… https://t.co/vbfOlk8tss"
I’ve only seen Fauci in media and we all know media isn’t real life so… https://t.co/RXHCHZwOaj
@JamesGunn This is bullshit just trying to take the blame away from China and Dr Fauci.
Fauci is basically admitting for sure the COVID-19 came from China https://t.co/zcm5voDxIM
Fauci encouraged that omicron doesn't appear to be more severe https://t.co/ntO8ztFCyo
GOP Senators Stoke Irrational Hatred Of Nonpartisan Scientist Fauci https://t.co/s1LEu92OFI
Dr. Rand Paul Joins Sean Hannity to Discuss Dr. Fauci's Ever-Changing Covid Guidance  https://t.co/3V7sYwq4Rt
A Frenchman did the science Fauci didn't: Omicron is no delta https://t.co/mtTwc46ZcM
"@bblock29 I'd Love to see a Debate btween Fauci Johnson, bet Ron would Not up for it , not Even a  SPELLING B!!!!"
Why Fox News lets Lara Logan call Dr. Fauci a Nazi — and get away with it  https://t.co/4KkFzuoDqZ
"A good day in Purgatorio — Dante Throws Shade At The Shade Of Omberto Whose Name Nearly Means “Shade,” Omberto Has… https://t.co/pRCKeKewpt"
Senator Bill Hagerty (R-TN) says if Dr. Fauci were a true scientist he would be promoting natural immunity over vac… https://t.co/qdNvRzzGC4
"The variant has over 50 mutations and is considered a ""variant of concern"" by the World Health Organization. https://t.co/rR3bXwTt09"
@EBraeden Yeah Lara used the wrong guy to compare Fauci.  She trying to call out Fauci on his handle of the Virus.… https://t.co/UxaIRcDe79
Saying if you sit next to someone with AIDS you can catch it..Fauci said that when AIDS first started.  Fauci respo… https://t.co/c3GG0paVvi
Birthing Person Withholds Christmas Gifts Until Son Gets Fauci Jab https://t.co/D8lFTgvjem
PETA Slams Fauci For Cruel HIV Experiments On Live Animals Lasting Decades https://t.co/Q72SWelKEa
"Watch: Fox News Peter Doocy Sets Up Fauci &amp; Walks Him Right Into A Trap, 'Is There Something To Do To... https://t.co/9zTsAIRCgM"
"Not just Fauci. The entire federal government of the United States is irreparably corrupt, evil, and needs to be ab… https://t.co/vzpuRMVXs5"
My list of who never to trust again: •CDC/WHO/FDA •Medical establishment/most doctors  •Media -ABC/CBS/NBC/CNN/Fox/… https://t.co/NAvwKbL20D
Good morning. This is your daily reminder that Fauci tortured puppies and funded reckless gain of function research… https://t.co/6rvovlhHSH
"Of course they are -- the Fauci ""shot of the month"" club, sponsored by Big Pharma. https://t.co/VIa6QH1di5"
Fauci made mistakes and woukd  not admit them! The Covid shot does not prevent Covid! https://t.co/1LkaZXyyW5
That trained medical professional is more interested in lining his pockets with profits from big drug companies. Fa… https://t.co/vmYEgKt0dq
"Fox’s Lara Logan is despicable person, just like Fox is despicable channel. Daring to compare Dr. Fauci with Nazi,… https://t.co/MAFdpSpry5"
Fauci says early reports encouraging about omicron variant https://t.co/AGSGq4GkXt
Dr. Fauci Isn’t Taking It Anymore As He Unloads On Sen. Ron Johnson https://t.co/PnQZC0CZBY via @politicususa
@2RoadsLife He would have like he didn’t fire Fauci
Fauci Says Early Reports Encouraging About Omicron Variant - https://t.co/Pvi0bu0X8C
"@CNNSotu Fauci always gets it, even from a fool."
"Fauci said that the US is re-evaluating the travel ban, a week after he said the ban would give the US time to prep… https://t.co/hQt4oDnoPw"
@aidnmclaughlin Joseph Mengele would be proud of Fauci
@AlecProgressive You just dropped a fauci meme on a guy born in 79 with a WWII reference (to which my grandfathers… https://t.co/gCqf6uQkcF
Fauci says early reports encouraging about omicron variant https://t.co/9kXxfUisBP
Ron Johnson didn’t go far enough. Fauci is guilty of medical crimes against humanity that make Josef Mengele look like Albert Schweitzer.
It just really is very annoying the way Fauci and the media talk about this junk. Let each individual person decide… https://t.co/QDzrHyNpXD
"Ivermectin works, it's cheap, its effective and it has no side effects. India used it to make the worst COVID19 out… https://t.co/6dhglRZf7d"
"Even if omicron proves less dangerous than delta, it remains problematic, World Health Organization epidemiologist… https://t.co/wlylBWHd1B"
🦠🤞🏼  Fauci says early reports encouraging about omicron variant (from @AP) https://t.co/iVqvMsjbOH
Dr. Fauci finally WRECKS Republican Senator live on air https://t.co/FdL4qdAtpR via @YouTube
"@dcherring All Fauci wants to do is save people, even if he made/makes s couple of missteps along the way.  House M… https://t.co/spa5JCwxa9"
The Sunday (News) Shows are not real journalism and Fauci is not a real doctor.  The Sunday Shows are a soap opera… https://t.co/gtWhoe3Xf0
@Breaking911 My #pureblood holiday is gonna be glorious! SUCK ME VIVEK. SUCK ME FAUCI.
@nrskim @savage39qa @DouglasDavisRN @oregon_mom_ I agree with that but not with what Fauci says.
@Motivation724 Fauci. Hands down. Joe is great but listen to the experts
@gnuman1979 It’s people waiting on what Dr Fauci tells them to do next
Fauci says early reports encouraging about omicron variant https://t.co/k5pMyAITn1
"Your a liar, because I said the covid vaccine helps, but they don't perform the way the drug companies said they wo… https://t.co/AH9iXCiZGd"
U.S. health officials said Sunday that while the omicron variant of the coronavirus is rapidly spreading throughout… https://t.co/pZJWFaiBGa
"U.S. health officials say that while the omicron variant of the coronavirus is rapidly spreading in the country, ea… https://t.co/iYFguCxRbl"
Fauci says early reports encouraging about omicron variant https://t.co/NPgXqQ6Kxr
Fauci says early reports encouraging about omicron variant https://t.co/UdqkeznFNz
U.S. health officials said Sunday that while the omicron variant of the coronavirus is rapidly spreading throughout… https://t.co/gZ1qNvSiKx
@SenTedCruz It should be 5 years per lie. Fauci would be in prison for the rest of his life.
‘How Do You Overhype That?’: Fauci Objects To Ron Johnson Claim That He Wants To Keep People Scared Of COVID… https://t.co/GJ7V6UIjNU
@sickendun2death @ksorbs One doesn't have to be an epidemiologist to garner facts from reliable sources.  Certainly… https://t.co/xZzMWAK2gt
"XI-BIDEN CHINA VIRUS PANDEMIC PLAN THRU THE 2022 &amp; 2024 ELECTIONS. (&amp; YES, FOOL FAUCI &amp; CHINESE MILITARY/OTHERS?)TH… https://t.co/kloq17gqgh"
Omicron variant found in almost one-third of U.S. states https://t.co/khwGm9U5eC https://t.co/k7PqipfA7p
Fauci has been wrong on everything.  Why is @POTUS still using him?
"Kimmel on GOP ‘scumbags’ smearing Fauci: ‘To scare Grandma, they need fresh villains’ https://t.co/KIUeWR85xK"
Jimmy Kimmel Gets Really Mad About Republican ‘Scumbags’ Attacking Anthony Fauci (Video) https://t.co/9n5ExX8noW
"When even fauci and indie sage are cautiously optimistic for better outcomes, I’d say Thats a win and a good thing"
"Watch: Fox News Peter Doocy Sets Up Fauci &amp; Walks Him Right Into A Trap, 'Is There Something To Do To... https://t.co/FeUz7zzW3Y"
Listen I love joe as much as the next guy but come on. I’m not defending fauci here because he’s also the same guy… https://t.co/DEDL7nHzfh
"@MZHemingway @MediaBuzzFNC yes, mollie. you tell them about fauci… i was almost ready to turn FOXnews off for an ex… https://t.co/wEldLVmf9Y"
Ron Johnson brutally flattened by Anthony Fauci for claiming he 'overhyped' the Covid-19 crisis https://t.co/TZehWSLMwe
@sir19631 @ChadTwoCrows @ksorbs Is that you fauci?  that is so dumb
Ron Johnson brutally flattened by Anthony Fauci for claiming he 'overhyped' the Covid-19 crisis https://t.co/xoTfuZ3kfS
@LTLZAK4242 @RealSaltySlim @fuctmind Get real. Fauci has been a know nothing bureaucrat since the 80s as a failure… https://t.co/tkX0rcDfe8
PETA to Fauci: Killing Monkeys in HIV/AIDS Experiments Must Stop https://t.co/T96Vi7BK8C
"Anthony Fauci says 'Wuhan strain,' which ignited a firestorm for admitting the 'racist' origin of COVID-19 https://t.co/Vm7tSHJUdQ"
Uncovered 2019 Video: Fauci &amp; HHS Conspire To Unleash “Virus” On The People https://t.co/EjT9fAp5Ee
@atensnut @ranenmatheus @NirradN @MarcFink222 @FearlessMomma34 @ShanPatriot @Misshu333 @GillilandLiza @swillsy3… https://t.co/2NMZ19FQpT
Raise your hand and retweet if you trust Dr. Fauci over Joe Rogan.  ✋  (should be a very obvious one)
Fauci: 'Every Reason To Believe' Boosters Protect Against Omicron #omicron #covid_19 #vaccinebooster protects https://t.co/yJFipT2pT9
@josecarreras1 Fauci have saved countless lives How many Lives has Trump saved (0) But he hid the Virus and THOUSANDS  DIED B.C. OF IT!!!
"So i convinced my mom and dad to get boosters, even though my dads trust has been broken in public health due to fa… https://t.co/rmwWLFhykE"
@LTLZAK4242 @RealSaltySlim @fuctmind Why? He didn’t fire Miley….damned sure didn’t fire Fauci &amp; he let Wray run the… https://t.co/ktO3kibKV8
Just ask yourself why The Democrats would make #Fauci the highest paid Government official.  Not just a highly comp… https://t.co/Z1qSipJnFF
"The Cuomo Bros, Alec Baldwin, Jack, &amp; now Don Lemon!? Did I just get served a bunch of birthdays this year? Whos ne… https://t.co/Z1WCccD9T6"
"@seanhannity Sean - Many Attempts To Call Have Failed/ Consider:  Fauci Is A Murder - Not An Accessory, But A Promo… https://t.co/caoowrCnCf"
@johncardillo Is the lesson that Fauci just loves masks?
@criticalban_d @lgbtqDOC doctor Fauci Lord MD PhD father 😫 said to mask up
I’m a BROKEN BROKEN RECORD. Been telling people about BULLSHIT being BULLSHIT since J2020HEAR ME?NO! Fredo?YES👆🏻You… https://t.co/ILlQmwm2wl
"🚨FINALLY⬇️the NIH WEBSITE, it’s LORD FAUCI’s scheme #1 Hospital Treatment: Remdesivir, @over $3k a pop-Gives the pa… https://t.co/hEMdpN0282"
Dr. Fauci LASHES OUT After Getting His Feelings Hurt by Fox News - https://t.co/KJqB8kBuFQ
@carolgargus @ABCPolitics Real America is done with #covid19. The only people who don't understand that Fauci and Biden.
@ChrisRothenber1 @ABCPolitics Real America is done with #covid19. The only people who don't understand that Fauci and Biden.
@balzoutwv @ABCPolitics Real America is done with #covid19. The only people who don't understand that Fauci and Biden.
@nellie812 @ABCPolitics Real America is done with #covid19.  The only people who don't understand that Fauci and Biden.
Dr Fauci &amp; The Truth Exposed On Film! Must Be Shared! https://t.co/MfXQHOS2xo
@Ronalbg @WHO Real America is done with #covid19.  The only people who don't understand that Fauci and Biden.
@franciscofromh @WHO Real America is done with #covid19.  The only people who don't understand that Fauci and Biden.
@rapplerdotcom Real America is done with #covid19.  The only people who don't understand that Fauci and Biden.
@Surgeon_General Real America is done with #covid19. The only people who don't understand that Fauci and Biden.
@ebottcher Enjoy the RATIO...Your boy Fauci was behind this too.
"If Dr Fauci represents science, why isn’t he speaking up about natural immunity?   Listen to more of my conversatio… https://t.co/tsDCi8HFCo"
Senator sparks anger by claiming Fauci is ‘overhyping’ Covid ‘the exact same’ way he did with AIDS  https://t.co/YrzS9Ej9N2
Correctly CNN Chris Cuomo fired him for his role with his brother but Tucker on Fox can compare Fauci to Mussolini… https://t.co/DODDemmMGU
@laralogan looks like FOX owns you bahahahahahaha https://t.co/T4sjTge1EB
"@pewpewonepew ‘Cold’ is just another way of spelling covid, so says Science Fauci"
@AlwaysVoteRed17 Fauci has always been about controlling us. We need to know how much money he gets from the vax patents and Big Pharma.
@AlwaysVoteRed17 I don’t even think Fauci believes it. He is there for the money and notoriety.
"@reachjulieroys What initially radicalized this poor soul? I mean, I remember when this Yale-educated guy would hos… https://t.co/E93Etg6oyf"
I’m losing count of the boogeyman trying to destroy conservative America  Is it Democrats Joe Biden Muslims China F… https://t.co/pNOQrkqtA8
"Fauci and gates helped create it. Obama and Biden gave the $1.8 mil to China to build the lab , they are all guilty… https://t.co/BCs0AZ6aul"
Blame Fox News -- Not Fauci -- For His Reported Refusal To Appear On Murdoch Network https://t.co/1xHpqrzb3e
"The White House's chief medical adviser, Dr. Anthony Fauci, says he believes the virus crisis will never come to an… https://t.co/36idiHBvST"
@NIH Dr. Fauci needs to stop talking. Just stop. We shouldn’t be relying on you.
"Fauci Dons Funny Hat, Declares Himself To Be Pope Of Science https://t.co/3ky9JfjY9f via @TheBabylonBee"
WEARING A MASK AND GLOVES TO PLAY FOOTBALL IN AN OUTDOOR STADIUM IS A BIT OVER THE TOPM IS DR FAUCI GOING TO THE GA… https://t.co/8hUCSAbipr
@TiffanyDCross ask about the RFKjr book saying the vaccines are just a big pharma power grab and Fauci is a fraud.… https://t.co/aYcEKq14xX
GOP Senator accuses Dr. Anthony Fauci of “overhyping” HIV on World AIDS Day - cityXtra Magazine… https://t.co/da9e2VUFoB
We must continue to shed light on the hypocrisy of Dr. Fauci. Thank you @brad_polumbo and @HannahDCox   https://t.co/mwg4SbY0Tz
@disclosetv Considering the health consequences to lockdowns would require critical thinking unlike Fauci and Burks… https://t.co/gsDMutHWiC
@ChristinaPushaw @ebottcher No. That's what Fauci said in the 80s. 🤦🏼‍♀️
@ebottcher This was literally the advice that Fauci gave but keep trying homey.
"@drourkeevans @BarackObama Either Gates or Fauci said, ""obviously if we want to know about the long term side effec… https://t.co/xMqOhLGbfJ"
Good morning. This is your daily reminder that Fauci tortured puppies and funded reckless gain of function research… https://t.co/yqjnMfOQWR
Independent fact checkers have corrected this to read: We haven’t proven that vaccines are safe or effective for an… https://t.co/bjiVFjBqUu
